{
  "id": "tasks-section",
  "title": "Задачи",
  "kind": "block",
  "category": "content",
  "maturity": "draft",
  "knowledge": "assumption",
  "purpose": "Задачи: самостоятельный блок страницы с адаптивной раскладкой.",
  "implementation": {
    "css": [
      "ui/hds.css"
    ],
    "markup": "examples/blocks/tasks/index.html"
  },
  "states": [
    "responsive"
  ],
  "examples": [
    "examples/blocks/tasks/index.html"
  ],
  "evidence": [
    "local:../temp/from-webflow/index.html",
    "local:../temp/from-webflow/ru",
    "docs/source-audit.md"
  ],
  "unknowns": [
    "Требуется дизайн-ревью перед переводом в stable."
  ]
}
