{
  "id": "promo-page",
  "title": "Тариф «Промо»",
  "kind": "page",
  "category": "company",
  "maturity": "draft",
  "knowledge": "assumption",
  "purpose": "Реконструкция страницы «Тариф «Промо»» для проверки состава блоков и адаптивного поведения.",
  "implementation": {
    "css": [
      "ui/hds.css"
    ],
    "markup": "examples/pages/promo/index.html"
  },
  "states": [
    "responsive"
  ],
  "examples": [
    "examples/pages/promo/index.html"
  ],
  "evidence": [
    "local:../temp/from-webflow/index.html",
    "local:../temp/from-webflow/ru",
    "docs/source-audit.md"
  ],
  "unknowns": [
    "Source-driven draft: состав блоков восстановлен, но точная визуальная сверка и часть исходных материалов ещё не завершены."
  ]
}
