{
  "id": "navigation",
  "title": "Навигация",
  "kind": "block",
  "category": "navigation",
  "maturity": "draft",
  "knowledge": "assumption",
  "purpose": "Навигация: переиспользуемая сущность общей архитектуры лендингов.",
  "implementation": {
    "css": [
      "ui/hds.css"
    ],
    "markup": "examples/collections/navigation/index.html"
  },
  "states": [
    "responsive"
  ],
  "examples": [
    "examples/collections/navigation/index.html"
  ],
  "evidence": [
    "temp/from-webflow/index.html",
    "temp/from-webflow/ru",
    "docs/source-audit.md"
  ],
  "unknowns": [
    "Требуется дизайн-ревью перед переводом в stable."
  ]
}
