{
  "id": "pricing-section",
  "title": "Тарифы",
  "kind": "block",
  "category": "commerce",
  "maturity": "draft",
  "knowledge": "assumption",
  "purpose": "Тарифы: переиспользуемая сущность общей архитектуры лендингов.",
  "implementation": {
    "css": [
      "ui/hds.css"
    ],
    "markup": "examples/blocks/pricing/index.html"
  },
  "states": [
    "responsive"
  ],
  "examples": [
    "examples/blocks/pricing/index.html"
  ],
  "evidence": [
    "temp/from-webflow/index.html",
    "temp/from-webflow/ru",
    "docs/source-audit.md"
  ],
  "unknowns": [
    "Требуется дизайн-ревью перед переводом в stable."
  ]
}
