{
  "id": "subscription-form",
  "title": "Форма подписки",
  "kind": "organism",
  "category": "forms",
  "maturity": "draft",
  "knowledge": "assumption",
  "purpose": "Форма подписки: переиспользуемая сущность общей архитектуры лендингов.",
  "implementation": {
    "css": [
      "ui/hds.css"
    ],
    "markup": "examples/organisms/subscription-form/index.html"
  },
  "states": [
    "responsive"
  ],
  "examples": [
    "examples/organisms/subscription-form/index.html"
  ],
  "evidence": [
    "temp/from-webflow/index.html",
    "temp/from-webflow/ru",
    "docs/source-audit.md"
  ],
  "unknowns": [
    "Требуется дизайн-ревью перед переводом в stable."
  ]
}
