{
  "id": "metric-card",
  "title": "Карточка метрики",
  "kind": "organism",
  "category": "content",
  "maturity": "draft",
  "knowledge": "assumption",
  "purpose": "Карточка метрики: составной компонент для повторного использования в блоках лендинга.",
  "implementation": {
    "css": [
      "ui/hds.css"
    ],
    "markup": "examples/organisms/metric-card/index.html"
  },
  "states": [
    "responsive"
  ],
  "examples": [
    "examples/organisms/metric-card/index.html"
  ],
  "evidence": [
    "local:../temp/from-webflow/index.html",
    "local:../temp/from-webflow/ru",
    "docs/source-audit.md"
  ],
  "unknowns": [
    "Требуется дизайн-ревью перед переводом в stable."
  ]
}
